title,authors,journal,year,keywords,abstract,url,pmcid
Mice in Bion-M 1 Space Mission: Training and Selection,Alexander Andreev-Andrievskiy; Anfisa Popova; Richard Boyle; Jeffrey Alberts; Boris Shenkman; Olga Vinogradova; Oleg Dolgov; Konstantin Anokhin; Darya Tsvirkun; Pavel Soldatov; Tatyana Nemirovskaya; Eugeniy Ilyin; Vladimir Sychev,PLoS ONE,,,,https://www.ncbi.nlm.nih.gov/pmc/articles/PMC4136787/,PMC4136787
Microgravity and Cellular Biology: Insights into Cellular Responses and Implications for Human Health,Nelson Adolfo López Garzón; María Virginia Pinzón-Fernández; Jhan S Saavedra T; Humberto A Nati-Castillo; Marlon Arias-Intriago; Camila Salazar-Santoliva; Juan S Izquierdo-Condoy,International Journal of Molecular Sciences,,,,https://www.ncbi.nlm.nih.gov/pmc/articles/PMC11988870/,PMC11988870
"Microgravity Induces Pelvic Bone Loss through Osteoclastic Activity, Osteocytic Osteolysis, and Osteoblastic Cell Cycle Inhibition by CDKN1a/p21",Elizabeth A Blaber; Natalya Dvorochkin; Chialing Lee; Joshua S Alwood; Rukhsana Yousuf; Piero Pianetta; Ruth K Globus; Brendan P Burns; Eduardo A C Almeida,PLoS ONE,,,,https://www.ncbi.nlm.nih.gov/pmc/articles/PMC3630201/,PMC3630201
Selective Proliferation of Highly Functional Adipose-Derived Stem Cells in Microgravity Culture with Stirred Microspheres,Takanobu Mashiko; Koji Kanayama; Natsumi Saito; Takako Shirado; Rintaro Asahi; Masanori Mori; Kotaro Yoshimura,Cells,,,,https://www.ncbi.nlm.nih.gov/pmc/articles/PMC7998608/,PMC7998608
Spaceflight Modulates the Expression of Key Oxidative Stress and Cell Cycle Related Genes in Heart,Akhilesh Kumar; Candice G T Tahimic; Eduardo A C Almeida; Ruth K Globus,International Journal of Molecular Sciences,,,,https://www.ncbi.nlm.nih.gov/pmc/articles/PMC8396460/,PMC8396460
Microgravity validation of a novel system for RNA isolation and multiplex quantitative real time PCR analysis of gene expression on the International Space Station,Macarena Parra; Jimmy Jung; Travis D Boone; Luan Tran; Elizabeth A Blaber; Mark Brown; Matthew Chin; Tori Chinn; Jacob Cohen; Robert Doebler; Dzung Hoang; Elizabeth Hyde; Matthew Lera; Louie T Luzod; Mark Mallinson; Oana Marcu; Youssef Mohamedaly; Antonio J Ricco; Kathleen Rubins; Gregory D Sgarlato; Rafael O Talavera; Peter Tong; Eddie Uribe; Jeffrey Williams; Diana Wu; Rukhsana Yousuf; Charles S Richey; Julie Schonfeld; Eduardo A C Almeida,PLoS ONE,,,,https://www.ncbi.nlm.nih.gov/pmc/articles/PMC5587110/,PMC5587110
High-precision method for cyclic loading of small-animal vertebrae to assess bone quality,Megan M Pendleton; Saghi Sadoughi; Alfred Li; Grace D O'Connell; Joshua S Alwood; Tony M Keaveny,Bone Reports,,,,https://www.ncbi.nlm.nih.gov/pmc/articles/PMC6222041/,PMC6222041
Dose- and Ion-Dependent Effects in the Oxidative Stress Response to Space-Like Radiation Exposure in the Skeletal System,Joshua S Alwood; Luan H Tran; Ann-Sofie Schreurs; Yasaman Shirazi-Fard; Akhilesh Kumar; Diane Hilton; Candice G T Tahimic; Ruth K Globus,International Journal of Molecular Sciences,,,,https://www.ncbi.nlm.nih.gov/pmc/articles/PMC5666799/,PMC5666799
From the bench to exploration medicine: NASA life sciences translational research for human exploration and habitation missions,Joshua S Alwood; April E Ronca; Richard C Mains; Mark J Shelhamer; Jeffrey D Smith; Thomas J Goodwin,NPJ Microgravity,,,,https://www.ncbi.nlm.nih.gov/pmc/articles/PMC5460236/,PMC5460236
Effects of ex vivo Ionizing Radiation on Collagen Structure and Whole-Bone Mechanical Properties of Mouse Vertebrae,Megan M Pendleton; Shannon R Emerzian; Jennifer Liu; Simon Y Tang; Grace D O’Connell; Joshua S Alwood; Tony M Keaveny,Bone,,,,https://www.ncbi.nlm.nih.gov/pmc/articles/PMC6813909/,PMC6813909
5AtRabD2b and AtRabD2c have overlapping functions in pollen development and pollen tube growth,Jianling Peng; Hilal Ilarslan; Eve Syrkin Wurtele; Diane C Bassham,BMC Plant Biology,,,,https://www.ncbi.nlm.nih.gov/pmc/articles/PMC3040128/,PMC3040128
TNO1 Is Involved in Salt Tolerance and Vacuolar Trafficking in Arabidopsis,Sang-Jin Kim; Diane C Bassham,Plant Physiology,,,,https://www.ncbi.nlm.nih.gov/pmc/articles/PMC3177255/,PMC3177255
Absence of γ-sarcoglycan alters the response of p70S6 kinase to mechanical perturbation in murine skeletal muscle,Catherine Moorwood; Anastassios Philippou; Janelle Spinazzola; Benjamin Keyser; Edward J Macarak; Elisabeth R Barton,Skeletal Muscle,,,,https://www.ncbi.nlm.nih.gov/pmc/articles/PMC4095884/,PMC4095884
Identification of a novel Golgi-localized putative glycosyltransferase protein in Arabidopsis thaliana,Natalia Rzepecka; Yoko Ito; Kei Yura; Emi Ito; Tomohiro Uemura,Plant Biotechnology,,,,https://www.ncbi.nlm.nih.gov/pmc/articles/PMC11500582/,PMC11500582
"TNO1, a TGN-localized SNARE-interacting protein, modulates root skewing in Arabidopsis thaliana",Rahul Roy; Diane C Bassham,BMC Plant Biology,,,,https://www.ncbi.nlm.nih.gov/pmc/articles/PMC5387210/,PMC5387210
The Drosophila SUN protein Spag4 cooperates with the coiled-coil protein Yuri Gagarin to maintain association of the basal body and spermatid nucleus,"Martin P Kracklauer; Heather M Wiora; William J Deery; Xin Chen; Benjamin Bolival, Jr; Dwight Romanowicz; Rebecca A Simonette; Margaret T Fuller; Janice A Fischer; Kathleen M Beckingham",Journal of Cell Science,,,,https://www.ncbi.nlm.nih.gov/pmc/articles/PMC2915878/,PMC2915878
Toll Mediated Infection Response Is Altered by Gravity and Spaceflight in Drosophila,Katherine Taylor; Kurt Kleinhesselink; Michael D George; Rachel Morgan; Tangi Smallwood; Ann S Hammonds; Patrick M Fuller; Perot Saelao; Jeff Alley; Allen G Gibbs; Deborah K Hoshizaki; Laurence von Kalm; Charles A Fuller; Kathleen M Beckingham; Deborah A Kimbrell,PLoS ONE,,,,https://www.ncbi.nlm.nih.gov/pmc/articles/PMC3901686/,PMC3901686
Author Correction: Multi-omics analysis of multiple missions to space reveal a theme of lipid dysregulation in mouse liver,Afshin Beheshti; Kaushik Chakravarty; Homer Fogle; Hossein Fazelinia; Willian A da Silveira; Valery Boyko; San-Huei Lai Polo; Amanda M Saravia-Butler; Gary Hardiman; Deanne Taylor; Jonathan M Galazka; Sylvain V Costes,Scientific Reports,,,,https://www.ncbi.nlm.nih.gov/pmc/articles/PMC6985101/,PMC6985101
GeneLab Database Analyses Suggest Long-Term Impact of Space Radiation on the Cardiovascular System by the Activation of FYN Through Reactive Oxygen Species,Afshin Beheshti; J Tyson McDonald; Jack Miller; Peter Grabham; Sylvain V Costes,International Journal of Molecular Sciences,,,,https://www.ncbi.nlm.nih.gov/pmc/articles/PMC6387434/,PMC6387434
Gravitropism and Lateral Root Emergence are Dependent on the Trans-Golgi Network Protein TNO1,Rahul Roy; Diane C Bassham,Frontiers in Plant Science,,,,https://www.ncbi.nlm.nih.gov/pmc/articles/PMC4642138/,PMC4642138
NASA GeneLab Platform Utilized for Biological Response to Space Radiation in Animal Models,J Tyson McDonald; Robert Stainforth; Jack Miller; Thomas Cahill; Willian A da Silveira; Komal S Rathi; Gary Hardiman; Deanne Taylor; Sylvain V Costes; Vinita Chauhan; Robert Meller; Afshin Beheshti,Cancers,,,,https://www.ncbi.nlm.nih.gov/pmc/articles/PMC7072278/,PMC7072278
FAIRness and Usability for Open-access Omics Data Systems,Daniel C Berrios; Afshin Beheshti; Sylvain V Costes,AMIA Annual Symposium Proceedings,,,,https://www.ncbi.nlm.nih.gov/pmc/articles/PMC6371294/,PMC6371294
Circulating miRNA Spaceflight Signature Reveals Targets for Countermeasure Development,Sherina Malkani; Christopher R Chin; Egle Cekanaviciute; Marie Mortreux; Hazeem Okinula; Marcel Tarbier; Ann-Sofie Schreurs; Yasaman Shirazi-Fard; Candice GT Tahimic; Deyra N Rodriguez; Brittany S Sexton; Daniel Butler; Akanksha Verma; Daniela Bezdan; Ceyda Durmaz; Matthew MacKay; Ari Melnick; Cem Meydan; Sheng Li; Francine Garrett-Bakelman; Bastian Fromm; Ebrahim Afshinnekoo; Brad W Langhorst; Eileen T Dimalanta; Margareth Cheng-Campbell; Elizabeth Blaber; Jonathan C Schisler; Charles Vanderburg; Marc R Friedländer; J Tyson McDonald; Sylvain V Costes; Seward Rutkove; Peter Grabham; Christopher E Mason; Afshin Beheshti,Cell reports,,,,https://www.ncbi.nlm.nih.gov/pmc/articles/PMC8441986/,PMC8441986
Machine learning algorithm to characterize antimicrobial resistance associated with the International Space Station surface microbiome,Pedro Madrigal; Nitin K Singh; Jason M Wood; Elena Gaudioso; Félix Hernández-del-Olmo; Christopher E Mason; Kasthuri Venkateswaran; Afshin Beheshti,Microbiome,,,,https://www.ncbi.nlm.nih.gov/pmc/articles/PMC9400218/,PMC9400218
Muscle atrophy phenotype gene expression during spaceflight is linked to a metabolic crosstalk in both the liver and the muscle in mice,Geraldine Vitry; Rebecca Finch; Gavin Mcstay; Afshin Behesti; Sébastien Déjean; Tricia Larose; Virginia Wotring; Willian Abraham da Silveira,iScience,,,,https://www.ncbi.nlm.nih.gov/pmc/articles/PMC9576569/,PMC9576569
Extraterrestrial Gynecology: Could Spaceflight Increase the Risk of Developing Cancer in Female Astronauts? An Updated Review,Rosa Drago-Ferrante; Riccardo Di Fiore; Fathi Karouia; Yashwanth Subbannayya; Saswati Das; Begum Aydogan Mathyk; Shehbeel Arif; Ana Paula Guevara-Cerdán; Allen Seylani; Aman Singh Galsinh; Weronika Kukulska; Joseph Borg; Sherif Suleiman; David Marshall Porterfield; Andrea Camera; Lane K Christenson; April Elizabeth Ronca; Jonathan G Steller; Afshin Beheshti; Jean Calleja-Agius,International Journal of Molecular Sciences,,,,https://www.ncbi.nlm.nih.gov/pmc/articles/PMC9267413/,PMC9267413
Aging and putative frailty biomarkers are altered by spaceflight,Andrea Camera; Marshall Tabetah; Veronica Castañeda; JangKeun Kim; Aman Singh Galsinh; Alissen Haro-Vinueza; Ivonne Salinas; Allen Seylani; Shehbeel Arif; Saswati Das; Marcelo A Mori; Anthony Carano; Lorraine Christine de Oliveira; Masafumi Muratani; Richard Barker; Victoria Zaksas; Chirag Goel; Eleni Dimokidis; Deanne M Taylor; Jisu Jeong; Eliah Overbey; Cem Meydan; D Marshall Porterfield; Juan Esteban Díaz; Andrés Caicedo; Jonathan C Schisler; Evagelia C Laiakis; Christopher E Mason; Man S Kim; Fathi Karouia; Nathaniel J Szewczyk; Afshin Beheshti,Scientific Reports,,,,https://www.ncbi.nlm.nih.gov/pmc/articles/PMC11166946/,PMC11166946
Space radiation damage rescued by inhibition of key spaceflight associated miRNAs,J Tyson McDonald; JangKeun Kim; Lily Farmerie; Meghan L Johnson; Nidia S Trovao; Shehbeel Arif; Keith Siew; Sergey Tsoy; Yaron Bram; Jiwoon Park; Eliah Overbey; Krista Ryon; Jeffrey Haltom; Urminder Singh; Francisco J Enguita; Victoria Zaksas; Joseph W Guarnieri; Michael Topper; Douglas C Wallace; Cem Meydan; Stephen Baylin; Robert Meller; Masafumi Muratani; D Marshall Porterfield; Brett Kaufman; Marcelo A Mori; Stephen B Walsh; Dominique Sigaudo-Roussel; Saida Mebarek; Massimo Bottini; Christophe A Marquette; Eve Syrkin Wurtele; Robert E Schwartz; Diego Galeano; Christopher E Mason; Peter Grabham; Afshin Beheshti,Nature Communications,,,,https://www.ncbi.nlm.nih.gov/pmc/articles/PMC11166944/,PMC11166944
"A comprehensive SARS-CoV-2 and COVID-19 review, Part 2: host extracellular to systemic effects of SARS-CoV-2 infection","S Anand Narayanan; David A Jamison, Jr; Joseph W Guarnieri; Victoria Zaksas; Michael Topper; Andrew P Koutnik; Jiwoon Park; Kevin B Clark; Francisco J Enguita; Ana Lúcia Leitão; Saswati Das; Pedro M Moraes-Vieira; Diego Galeano; Christopher E Mason; Nídia S Trovão; Robert E Schwartz; Jonathan C Schisler; Jordana G A Coelho-dos-Reis; Eve Syrkin Wurtele; Afshin Beheshti",European Journal of Human Genetics,,,,https://www.ncbi.nlm.nih.gov/pmc/articles/PMC10772081/,PMC10772081
Ethical considerations for the age of non-governmental space exploration,Allen Seylani; Aman Singh Galsinh; Alexia Tasoula; Anu R I; Andrea Camera; Jean Calleja-Agius; Joseph Borg; Chirag Goel; JangKeun Kim; Kevin B Clark; Saswati Das; Shehbeel Arif; Michael Boerrigter; Caroline Coffey; Nathaniel Szewczyk; Christopher E Mason; Maria Manoli; Fathi Karouia; Hansjörg Schwertz; Afshin Beheshti; Dana Tulodziecki,Nature Communications,,,,https://www.ncbi.nlm.nih.gov/pmc/articles/PMC11166968/,PMC11166968
Chromosomal positioning and epigenetic architecture influence DNA methylation patterns triggered by galactic cosmic radiation,Adrian Perdyan; Marcin Jąkalski; Monika Horbacz; Afshin Beheshti; Jakub Mieczkowski,Scientific Reports,,,,https://www.ncbi.nlm.nih.gov/pmc/articles/PMC10789781/,PMC10789781
Prolonged Exposure to Microgravity Reduces Cardiac Contractility and Initiates Remodeling in Drosophila,Stanley Walls; Soda Diop; Ryan Birse; Lisa Elmen; Zhuohui Gan; Sreehari Kalvakuri; Santiago Pineda; Curran Reddy; Erika Taylor; Bosco Trinh; Georg Vogler; Rachel Zarndt; Andrew McCulloch; Peter Lee; Sharmila Bhattacharya; Rolf Bodmer; Karen Ocorr,Cell reports,,,,https://www.ncbi.nlm.nih.gov/pmc/articles/PMC7787258/,PMC7787258
Bundling up the Role of the Actin Cytoskeleton in Primary Root Growth,Judith García-González; Kasper van Gelderen,Frontiers in Plant Science,,,,https://www.ncbi.nlm.nih.gov/pmc/articles/PMC8716943/,PMC8716943
ERULUS Is a Plasma Membrane-Localized Receptor-Like Kinase That Specifies Root Hair Growth by Maintaining Tip-Focused Cytoplasmic Calcium Oscillations,Taegun Kwon; J Alan Sparks; Fuqi Liao; Elison B Blancaflor,The Plant Cell,,,,https://www.ncbi.nlm.nih.gov/pmc/articles/PMC6048781/,PMC6048781
Spaceflight and simulated microgravity conditions increase virulence of Serratia marcescens in the Drosophila melanogaster infection model,Rachel Gilbert; Medaya Torres; Rachel Clemens; Shannon Hateley; Ravikumar Hosamani; William Wade; Sharmila Bhattacharya,NPJ Microgravity,,,,https://www.ncbi.nlm.nih.gov/pmc/articles/PMC7000411/,PMC7000411
HLB1 Is a Tetratricopeptide Repeat Domain-Containing Protein That Operates at the Intersection of the Exocytic and Endocytic Pathways at the TGN/EE in Arabidopsis,J Alan Sparks; Taegun Kwon; Luciana Renna; Fuqi Liao; Federica Brandizzi; Elison B Blancaflor,The Plant Cell,,,,https://www.ncbi.nlm.nih.gov/pmc/articles/PMC4826010/,PMC4826010
Brassinosteroids Inhibit Autotropic Root Straightening by Modifying Filamentous-Actin Organization and Dynamics,Louise de Bang; Ana Paez-Garcia; Ashley E Cannon; Sabrina Chin; Jaydeep Kolape; Fuqi Liao; J Alan Sparks; Qingzhen Jiang; Elison B Blancaflor,Frontiers in Plant Science,,,,https://www.ncbi.nlm.nih.gov/pmc/articles/PMC7010715/,PMC7010715
Impact of microgravity and lunar gravity on murine skeletal and immune systems during space travel,Yui Okamura; Kei Gochi; Tatsuya Ishikawa; Takuto Hayashi; Sayaka Fuseya; Riku Suzuki; Maho Kanai; Yuri Inoue; Yuka Murakami; Shunya Sadaki; Hyojung Jeon; Mio Hayama; Hiroto Ishii; Yuki Tsunakawa; Hiroki Ochi; Shingo Sato; Michito Hamada; Chikara Abe; Hironobu Morita; Risa Okada; Dai Shiba; Masafumi Muratani; Masahiro Shinohara; Taishin Akiyama; Takashi Kudo; Satoru Takahashi,Scientific Reports,,,,https://www.ncbi.nlm.nih.gov/pmc/articles/PMC11579474/,PMC11579474
Spatial and temporal localization of SPIRRIG and WAVE/SCAR reveal roles for these proteins in actin-mediated root hair development,Sabrina Chin; Taegun Kwon; Bibi Rafeiza Khan; J Alan Sparks; Eileen L Mallery; Daniel B Szymanski; Elison B Blancaflor,The Plant Cell,,,,https://www.ncbi.nlm.nih.gov/pmc/articles/PMC8364238/,PMC8364238
Cell Type-Specific Imaging of Calcium Signaling in Arabidopsis thaliana Seedling Roots Using GCaMP3,William Krogman; J Alan Sparks; Elison B Blancaflor,International Journal of Molecular Sciences,,,,https://www.ncbi.nlm.nih.gov/pmc/articles/PMC7503278/,PMC7503278
S. aureus MscL Is a Pentamer In Vivo but of Variable Stoichiometries In Vitro: Implications for Detergent-Solubilized Membrane Proteins,Michael R Dorwart; Robin Wray; Chad A Brautigam; Youxing Jiang; Paul Blount,PLoS Biology,,,,https://www.ncbi.nlm.nih.gov/pmc/articles/PMC2998437/,PMC2998437
Manipulating the permeation of charged compounds through the MscL nanovalve,Li-Min Yang; Paul Blount,The FASEB Journal,,,,https://www.ncbi.nlm.nih.gov/pmc/articles/PMC3005423/,PMC3005423
The oligomeric state of the truncated mechanosensitive channel of large conductance shows no variance in vivo,Irene Iscla; Robin Wray; Paul Blount,Protein Science : A Publication of the Protein Society,,,,https://www.ncbi.nlm.nih.gov/pmc/articles/PMC3190158/,PMC3190158
Three Routes to Modulate the Pore Size of the MscL Channel/Nanovalve,Li-Min Yang; Robin Wray; Juandell Parker; Danyell Wilson; Randolph S Duran; Paul Blount,ACS Nano,,,,https://www.ncbi.nlm.nih.gov/pmc/articles/PMC3289768/,PMC3289768
The MscS and MscL Families of Mechanosensitive Channels Act as Microbial Emergency Release Valves,Ian R Booth; Paul Blount,Journal of Bacteriology,,,,https://www.ncbi.nlm.nih.gov/pmc/articles/PMC3430326/,PMC3430326
The dynamics of protein-protein interactions between domains of MscL at the cytoplasmic-lipid interface,Irene Iscla; Robin Wray; Paul Blount,Channels,,,,https://www.ncbi.nlm.nih.gov/pmc/articles/PMC3508904/,PMC3508904
Chimeras reveal a single lipid-interface residue that controls MscL channel kinetics as well as mechanosensitivity,Li-Min Yang; Dalian Zhong; Paul Blount,Cell reports,,,,https://www.ncbi.nlm.nih.gov/pmc/articles/PMC3593973/,PMC3593973
Reply to Bemm et al. and Arakawa: Identifying foreign genes in independent Hypsibius dujardini genome assemblies,Thomas C Boothby; Bob Goldstein,Proceedings of the National Academy of Sciences of the United States of America,,,,https://www.ncbi.nlm.nih.gov/pmc/articles/PMC4896697/,PMC4896697
"Correction for Boothby et al., Evidence for extensive horizontal gene transfer from the draft genome of a tardigrade",,Proceedings of the National Academy of Sciences of the United States of America,,,,https://www.ncbi.nlm.nih.gov/pmc/articles/PMC5018776/,PMC5018776
Tardigrade secretory proteins protect biological structures from desiccation,Samuel Lim; Charles B Reilly; Zeina Barghouti; Benedetto Marelli; Jeffrey C Way; Pamela A Silver,Communications Biology,,,,https://www.ncbi.nlm.nih.gov/pmc/articles/PMC11127935/,PMC11127935
Correction to: The Evolution of Temperature and Desiccation-Related Protein Families in Tardigrada Reveals a Complex Acquisition of Extremotolerance,,Genome Biology and Evolution,,,,https://www.ncbi.nlm.nih.gov/pmc/articles/PMC11831363/,PMC11831363
Possible roles of CAHS proteins from Tardigrade in osmotic stress tolerance in mammalian cells,Takahiro Bino; Yuhei Goto; Gembu Maryu; Kazuharu Arakawa; Kazuhiro Aoki,Cell Structure and Function,,,,https://www.ncbi.nlm.nih.gov/pmc/articles/PMC11930778/,PMC11930778
Production of reactive oxygen species and involvement of bioprotectants during anhydrobiosis in the tardigrade Paramacrobiotus spatialis,Ilaria Giovannini; Thomas C Boothby; Michele Cesari; Bob Goldstein; Roberto Guidetti; Lorena Rebecchi,Scientific Reports,,,,https://www.ncbi.nlm.nih.gov/pmc/articles/PMC8816950/,PMC8816950
Partial weight suspension: a novel murine model for investigating adaptation to reduced musculoskeletal loading,Erika B Wagner; Nicholas P Granzella; Hiroaki Saito; Dava J Newman; Laurence R Young; Mary L Bouxsein,Journal of Applied Physiology,,,,https://www.ncbi.nlm.nih.gov/pmc/articles/PMC3774184/,PMC3774184
Spaceflight and hind limb unloading induce similar changes in electrical impedance characteristics of mouse gastrocnemius muscle,M Sung; J Li; AJ Spieker; J Spatz; R Ellman; VL Ferguson; TA Bateman; GD Rosen; M Bouxsein; SB Rutkove,Journal of musculoskeletal & neuronal interactions,,,,https://www.ncbi.nlm.nih.gov/pmc/articles/PMC4653813/,PMC4653813
"Partial Reductions in Mechanical Loading Yield Proportional Changes in Bone Density, Bone Architecture, and Muscle Mass",Rachel Ellman; Jordan Spatz; Alison Cloutier; Rupert Palme; Blaine A Christiansen; Mary L Bouxsein,Journal of bone and mineral research : the official journal of the American Society for Bone and Mineral Research,,,,https://www.ncbi.nlm.nih.gov/pmc/articles/PMC4118556/,PMC4118556
Proteomic and phosphoproteomic characterization of cardiovascular tissues after long term exposure to simulated space radiation,Yared H Kidane; Franklin H Lee; Matthew F Smith; Chunbo Wang; Jacqueline Barbera Mirza; Saachi Sharma; Alejandro A Lobo; Krish C Dewan; Jengwei Chen; Thomas E Diaz; Michelle Mendiola Pla; Matthew W Foster; Dawn E Bowles,Frontiers in Physiology,,,,https://www.ncbi.nlm.nih.gov/pmc/articles/PMC11063234/,PMC11063234
RNAseq and RNA molecular barcoding reveal differential gene expression in cortical bone following hindlimb unloading in female mice,Jordan M Spatz; Frank C Ko; Ugur M Ayturk; Matthew L Warman; Mary L Bouxsein,PLoS ONE,,,,https://www.ncbi.nlm.nih.gov/pmc/articles/PMC8509868/,PMC8509868
Multi-omics analysis of multiple missions to space reveal a theme of lipid dysregulation in mouse liver,Afshin Beheshti; Kaushik Chakravarty; Homer Fogle; Hossein Fazelinia; Willian A da Silveira; Valery Boyko; San-Huei Lai Polo; Amanda M Saravia-Butler; Gary Hardiman; Deanne Taylor; Jonathan M Galazka; Sylvain V Costes,Scientific Reports,,,,https://www.ncbi.nlm.nih.gov/pmc/articles/PMC6915713/,PMC6915713
Treatment With a Soluble Bone Morphogenetic Protein Type 1A Receptor (BMPR1A) Fusion Protein Increases Bone Mass and Bone Formation in Mice Subjected to Hindlimb Unloading,Frank C Ko; Miranda Van Vliet; Rachel Ellman; Daniel Grasso; Daniel J Brooks; Jordan M Spatz; Chrissy Conlon; J Ignacio Aguirre; Thomas J Wronski; Mary L Bouxsein,JBMR Plus,,,,https://www.ncbi.nlm.nih.gov/pmc/articles/PMC6124165/,PMC6124165
"Morphology of the Utricular Otolith Organ in the Toadfish, Opsanus tau",Richard Boyle; Reza Ehsanian; Alireza Mofrad; Yekaterina Popova; Joseph Varelas,The Journal of comparative neurology,,,,https://www.ncbi.nlm.nih.gov/pmc/articles/PMC5899691/,PMC5899691
Adaptive Changes in the Vestibular System of Land Snail to a 30-Day Spaceflight and Readaptation on Return to Earth,Nikolay Aseyev; Alia Kh Vinarskaya; Matvey Roshchin; Tatiana A Korshunova; Aleksey Yu Malyshev; Alena B Zuzina; Victor N Ierusalimsky; Maria S Lemak; Igor S Zakharov; Ivan A Novikov; Peter Kolosov; Ekaterina Chesnokova; Svetlana Volkova; Artem Kasianov; Leonid Uroshlev; Yekaterina Popova; Richard D Boyle; Pavel M Balaban,Frontiers in Cellular Neuroscience,,,,https://www.ncbi.nlm.nih.gov/pmc/articles/PMC5672023/,PMC5672023
"Influence of Magnitude and Duration of Altered Gravity and Readaptation to 1 g on the Structure and Function of the Utricle in Toadfish, Opsanus tau",Richard Boyle; Yekaterina Popova; Joseph Varelas,Frontiers in Physiology,,,,https://www.ncbi.nlm.nih.gov/pmc/articles/PMC6204554/,PMC6204554
IRE1: ER stress sensor and cell fate executor,Yani Chen; Federica Brandizzi,Trends in cell biology,,,,https://www.ncbi.nlm.nih.gov/pmc/articles/PMC3818365/,PMC3818365
Organization of the ER–Golgi interface for membrane traffic control,Federica Brandizzi; Charles Barlowe,Nature reviews. Molecular cell biology,,,,https://www.ncbi.nlm.nih.gov/pmc/articles/PMC4064004/,PMC4064004
INTER-REGULATION OF THE UNFOLDED PROTEIN RESPONSE AND AUXIN SIGNALING,Yani Chen; Kyaw Aung; Jakub Rolčík; Kathryn Walicki; Jiří Friml; Federica Brandizzi,The Plant journal : for cell and molecular biology,,,,https://www.ncbi.nlm.nih.gov/pmc/articles/PMC3981873/,PMC3981873
Endoplasmic reticulum—shape and function in stress translation,Federica Brandizzi; Lorenzo Frigerio; Stephen H Howell; Patrick Schäfer,Frontiers in Plant Science,,,,https://www.ncbi.nlm.nih.gov/pmc/articles/PMC4150462/,PMC4150462
Galactose-Depleted Xyloglucan Is Dysfunctional and Leads to Dwarfism in Arabidopsis,Yingzhen Kong; Maria J Peña; Luciana Renna; Utku Avci; Sivakumar Pattathil; Sami T Tuomivaara; Xuemei Li; Wolf-Dieter Reiter; Federica Brandizzi; Michael G Hahn; Alan G Darvill; William S York; Malcolm A O’Neill,Plant Physiology,,,,https://www.ncbi.nlm.nih.gov/pmc/articles/PMC4378170/,PMC4378170
Vesicles versus Tubes: Is Endoplasmic Reticulum-Golgi Transport in Plants Fundamentally Different from Other Eukaryotes?,David G Robinson; Federica Brandizzi; Chris Hawes; Akihiko Nakano,Plant Physiology,,,,https://www.ncbi.nlm.nih.gov/pmc/articles/PMC4453782/,PMC4453782
Pectin Methylesterification Impacts the Relationship between Photosynthesis and Plant Growth,Sarathi M Weraduwage; Sang-Jin Kim; Luciana Renna; Fransisca C Anozie; Thomas D Sharkey; Federica Brandizzi,Plant Physiology,,,,https://www.ncbi.nlm.nih.gov/pmc/articles/PMC4902601/,PMC4902601
REDUCED CHLOROPLAST COVERAGE genes from Arabidopsis thaliana help to establish the size of the chloroplast compartment,Robert M Larkin; Giovanni Stefano; Michael E Ruckle; Andrea K Stavoe; Christopher A Sinkler; Federica Brandizzi; Carolyn M Malmstrom; Katherine W Osteryoung,Proceedings of the National Academy of Sciences of the United States of America,,,,https://www.ncbi.nlm.nih.gov/pmc/articles/PMC4776492/,PMC4776492
Relevance of the Unfolded Protein Response to Spaceflight-Induced Transcriptional Reprogramming in Arabidopsis,Evan Angelos; Dae Kwan Ko; Starla Zemelis-Durfee; Federica Brandizzi,Astrobiology,,,,https://www.ncbi.nlm.nih.gov/pmc/articles/PMC7987364/,PMC7987364
Maintaining the Factory: The Roles of the Unfolded Protein Response in Cellular Homeostasis in Plants,Evan Angelos; Cristina Ruberti; Sang-Jin Kim; Federica Brandizzi,The Plant journal : for cell and molecular biology,,,,https://www.ncbi.nlm.nih.gov/pmc/articles/PMC5415411/,PMC5415411
NADPH Oxidase activity is required for ER stress survival in plants,Evan Angelos; Federica Brandizzi,The Plant journal : for cell and molecular biology,,,,https://www.ncbi.nlm.nih.gov/pmc/articles/PMC6289879/,PMC6289879
"Unfolded protein response in plants: one master, many questions",Cristina Ruberti; Sang-Jin Kim; Giovanni Stefano; Federica Brandizzi,Current opinion in plant biology,,,,https://www.ncbi.nlm.nih.gov/pmc/articles/PMC4618186/,PMC4618186
