title,authors,journal,year,keywords,abstract,url,pmcid
Brachypodium distachyon Seedlings Display Accession-Specific Morphological and Transcriptomic Responses to the Microgravity Environment of the International Space Station,Shih-Heng Su; Howard G Levine; Patrick H Masson,Life,,,,https://www.ncbi.nlm.nih.gov/pmc/articles/PMC10058394/,PMC10058394
A member of the CONSTANS-Like protein family is a putative regulator of reactive oxygen species homeostasis and spaceflight physiological adaptation,Natasha J Sng; Bryan Kolaczkowski; Robert J Ferl; Anna-Lisa Paul,AoB Plants,,,,https://www.ncbi.nlm.nih.gov/pmc/articles/PMC6348315/,PMC6348315
ARG1 Functions in the Physiological Adaptation of Undifferentiated Plant Cells to Spaceflight,Agata K Zupanska; Eric R Schultz; JiQiang Yao; Natasha J Sng; Mingqi Zhou; Jordan B Callaham; Robert J Ferl; Anna-Lisa Paul,Astrobiology,,,,https://www.ncbi.nlm.nih.gov/pmc/articles/PMC8024390/,PMC8024390
HSFA2 Functions in the Physiological Adaptation of Undifferentiated Plant Cells to Spaceflight,Agata K Zupanska; Collin LeFrois; Robert J Ferl; Anna-Lisa Paul,International Journal of Molecular Sciences,,,,https://www.ncbi.nlm.nih.gov/pmc/articles/PMC6359015/,PMC6359015
Beyond Low-Earth Orbit: Characterizing Immune and microRNA Differentials following Simulated Deep Spaceflight Conditions in Mice,Amber M Paul; Margareth Cheng-Campbell; Elizabeth A Blaber; Sulekha Anand; Sharmila Bhattacharya; Sara R Zwart; Brian E Crucian; Scott M Smith; Robert Meller; Peter Grabham; Afshin Beheshti,iScience,,,,https://www.ncbi.nlm.nih.gov/pmc/articles/PMC7756144/,PMC7756144
Neutrophil-to-Lymphocyte Ratio: A Biomarker to Monitor the Immune Status of Astronauts,Amber M Paul; Siddhita D Mhatre; Egle Cekanaviciute; Ann-Sofie Schreurs; Candice G T Tahimic; Ruth K Globus; Sulekha Anand; Brian E Crucian; Sharmila Bhattacharya,Frontiers in Immunology,,,,https://www.ncbi.nlm.nih.gov/pmc/articles/PMC7667275/,PMC7667275
Immunological and hematological outcomes following protracted low dose/low dose rate ionizing radiation and simulated microgravity,Amber M Paul; Eliah G Overbey; Willian A da Silveira; Nathaniel Szewczyk; Nina C Nishiyama; Michael J Pecaut; Sulekha Anand; Jonathan M Galazka; Xiao Wen Mao,Scientific Reports,,,,https://www.ncbi.nlm.nih.gov/pmc/articles/PMC8169688/,PMC8169688
Epigenomic Regulators Elongator Complex Subunit 2 and Methyltransferase 1 Differentially Condition the Spaceflight Response in Arabidopsis,Anna-Lisa Paul; Natasha Haveman; Brandon Califar; Robert J Ferl,Frontiers in Plant Science,,,,https://www.ncbi.nlm.nih.gov/pmc/articles/PMC8475764/,PMC8475764
Plants grown in Apollo lunar regolith present stress-associated transcriptomes that inform prospects for lunar exploration,Anna-Lisa Paul; Stephen M Elardo; Robert Ferl,Communications Biology,,,,https://www.ncbi.nlm.nih.gov/pmc/articles/PMC9098553/,PMC9098553
Artificial Gravity Partially Protects Space-induced Neurological Deficits in Drosophila melanogaster,Siddhita D Mhatre; Janani Iyer; Juli Petereit; Roberta M Dolling-Boreham; Anastasia Tyryshkina; Amber Paul; Rachel Gilbert; Matthew Jensen; Rebekah J Woolsey; Sulekha Anand; Marianne B Sowa; David R Quilici; Sylvain V Costes; Santhosh Girirajan; Sharmila Bhattacharya,Cell reports,,,,https://www.ncbi.nlm.nih.gov/pmc/articles/PMC10503492/,PMC10503492
Correction: Changes in Mouse Thymus and Spleen after Return from the STS-135 Mission in Space,Daila S Gridley; Xiao Wen Mao; Louis S Stodieck; Virginia L Ferguson; Ted A Bateman; Maria Moldovan; Christopher E Cunningham; Tamako A Jones; Jerry M Slater; Michael J Pecaut,PLoS ONE,,,,https://www.ncbi.nlm.nih.gov/pmc/articles/PMC3792163/,PMC3792163
Utilizing the KSC Fixation Tube to Conduct Human-Tended Plant Biology Experiments on a Suborbital Spaceflight,Natasha J Haveman; Mingqi Zhou; Jordan Callaham; Hunter F Strickland; Donald Houze; Susan Manning-Roach; Gerard Newsham; Anna-Lisa Paul; Robert J Ferl,Life,,,,https://www.ncbi.nlm.nih.gov/pmc/articles/PMC9693084/,PMC9693084
Changes in the distribution and function of leukocytes after whole-body iron ion irradiation,Daila S Gridley; Michael J Pecaut,Journal of Radiation Research,,,,https://www.ncbi.nlm.nih.gov/pmc/articles/PMC5045078/,PMC5045078
Is spaceflight-induced immune dysfunction linked to systemic changes in metabolism?,Michael J Pecaut; Xiao Wen Mao; Denise L Bellinger; Karen R Jonscher; Louis S Stodieck; Virginia L Ferguson; Ted A Bateman; Robert P Mohney; Daila S Gridley,PLoS ONE,,,,https://www.ncbi.nlm.nih.gov/pmc/articles/PMC5443495/,PMC5443495
Spaceflight Activates Autophagy Programs and the Proteasome in Mouse Liver,Elizabeth A Blaber; Michael J Pecaut; Karen R Jonscher,International Journal of Molecular Sciences,,,,https://www.ncbi.nlm.nih.gov/pmc/articles/PMC5666744/,PMC5666744
Post-Spaceflight (STS-135) Mouse Splenocytes Demonstrate Altered Activation Properties and Surface Molecule Expression,Shen-An Hwang; Brian Crucian; Clarence Sams; Jeffrey K Actor,PLoS ONE,,,,https://www.ncbi.nlm.nih.gov/pmc/articles/PMC4430214/,PMC4430214
Vive la radiorésistance!: converging research in radiobiology and biogerontology to enhance human radioresistance for deep space exploration and colonization,Franco Cortese; Dmitry Klokov; Andreyan Osipov; Jakub Stefaniak; Alexey Moskalev; Jane Schastnaya; Charles Cantor; Alexander Aliper; Polina Mamoshina; Igor Ushakov; Alex Sapetsky; Quentin Vanhaelen; Irina Alchinova; Mikhail Karganov; Olga Kovalchuk; Ruth Wilkins; Andrey Shtemberg; Marjan Moreels; Sarah Baatout; Evgeny Izumchenko; João Pedro de Magalhães; Artem V Artemov; Sylvain V Costes; Afshin Beheshti; Xiao Wen Mao; Michael J Pecaut; Dmitry Kaminskiy; Ivan V Ozerov; Morten Scheibye-Knudsen; Alex Zhavoronkov,Oncotarget,,,,https://www.ncbi.nlm.nih.gov/pmc/articles/PMC5865701/,PMC5865701
Spaceflight-Induced Gene Expression Profiles in the Mouse Brain Are Attenuated by Treatment with the Antioxidant BuOE,Isaac Kremsky; Samir Ali; Seta Stanbouly; Jacob Holley; Stephen Justinen; Michael Pecaut; James Crapo; Xiaowen Mao,International Journal of Molecular Sciences,,,,https://www.ncbi.nlm.nih.gov/pmc/articles/PMC10487739/,PMC10487739
Transcriptomic Effects on the Mouse Heart Following 30 Days on the International Space Station,Alicia L Veliz; Lana Mamoun; Lorelei Hughes; Richard Vega; Bailey Holmes; Andrea Monteon; Jillian Bray; Michael J Pecaut; Mary Kearns-Jonker,Biomolecules,,,,https://www.ncbi.nlm.nih.gov/pmc/articles/PMC9953463/,PMC9953463
Proteomic Analysis of Mouse Brain Subjected to Spaceflight,Xiao Wen Mao; Lawrence B Sandberg; Daila S Gridley; E Clifford Herrmann; Guangyu Zhang; Ravi Raghavan; Roman A Zubarev; Bo Zhang; Louis S Stodieck; Virginia L Ferguson; Ted A Bateman; Michael J Pecaut,International Journal of Molecular Sciences,,,,https://www.ncbi.nlm.nih.gov/pmc/articles/PMC6337482/,PMC6337482
Phosphoinositide-signaling is one component of a robust plant defense response,Chiu-Yueh Hung; Peter Aspesi Jr; Melissa R Hunter; Aaron W Lomax; Imara Y Perera,Frontiers in Plant Science,,,,https://www.ncbi.nlm.nih.gov/pmc/articles/PMC4052902/,PMC4052902
Genome-Wide Analysis of the PERK Gene Family in Brassica napus L. and Their Potential Roles in Clubroot Disease,Zeyu Zhang; Tongyu Fu; Cong Zhou; Fan Liu; Lingyi Zeng; Li Ren; Chaobo Tong; Lijiang Liu; Li Xu,International Journal of Molecular Sciences,,,,https://www.ncbi.nlm.nih.gov/pmc/articles/PMC11942576/,PMC11942576
Conserved plant transcriptional responses to microgravity from two consecutive spaceflight experiments,Eric S Land; James Sheppard; Colleen J Doherty; Imara Y Perera,Frontiers in Plant Science,,,,https://www.ncbi.nlm.nih.gov/pmc/articles/PMC10800490/,PMC10800490
Uncovering Transcriptional Responses to Fractional Gravity in Arabidopsis Roots,James Sheppard; Eric S Land; Tiffany Aurora Toennisson; Colleen J Doherty; Imara Y Perera,Life,,,,https://www.ncbi.nlm.nih.gov/pmc/articles/PMC8539686/,PMC8539686
Functional Changes in the Snail Statocyst System Elicited by Microgravity,Pavel M Balaban; Aleksey Y Malyshev; Victor N Ierusalimsky; Nikolay Aseyev; Tania A Korshunova; Natasha I Bravarenko; M S Lemak; Matvey Roshchin; Igor S Zakharov; Yekaterina Popova; Richard Boyle,PLoS ONE,,,,https://www.ncbi.nlm.nih.gov/pmc/articles/PMC3066201/,PMC3066201
RNAseq Analysis of Rodent Spaceflight Experiments Is Confounded by Sample Collection Techniques,San-Huei Lai Polo; Amanda M Saravia-Butler; Valery Boyko; Marie T Dinh; Yi-Chun Chen; Homer Fogle; Sigrid S Reinsch; Shayoni Ray; Kaushik Chakravarty; Oana Marcu; Rick B Chen; Sylvain V Costes; Jonathan M Galazka,iScience,,,,https://www.ncbi.nlm.nih.gov/pmc/articles/PMC7756143/,PMC7756143
Simulated microgravity impairs human NK cell cytotoxic activity against space radiation-relevant leukemic cells,Bradford M Kuhlman; Jonathan H Diaz; Trang Simon; Kimberly D Reeves; Stephen J Walker; Anthony Atala; Graça Almeida-Porada; Christopher D Porada,NPJ Microgravity,,,,https://www.ncbi.nlm.nih.gov/pmc/articles/PMC11324864/,PMC11324864
Multi-analyte Biochip (MAB) Based on All-solid-state Ion-selective Electrodes (ASSISE) for Physiological Research,Wan W Amani Wan Salim; Michael A Zeitchek; Andrew C Hermann; Antonio J Ricco; Ming Tan; Florian Selch; Erich Fleming; Brad M Bebout; Mamoun M Bader; Aeraj ul Haque; D Marshall Porterfield,Journal of Visualized Experiments : JoVE,,,,https://www.ncbi.nlm.nih.gov/pmc/articles/PMC3665236/,PMC3665236
Sequencing the Genomes of the First Terrestrial Fungal Lineages: What Have We Learned?,Andrii P Gryganskyi; Jacob Golan; Anna Muszewska; Alexander Idnurm; Somayeh Dolatabadi; Stephen J Mondo; Vira B Kutovenko; Volodymyr O Kutovenko; Michael T Gajdeczka; Iryna M Anishchenko; Julia Pawlowska; Ngoc Vinh Tran; Ingo Ebersberger; Kerstin Voigt; Yan Wang; Ying Chang; Teresa E Pawlowska; Joseph Heitman; Rytas Vilgalys; Gregory Bonito; Gerald L Benny; Matthew E Smith; Nicole Reynolds; Timothy Y James; Igor V Grigoriev; Joseph W Spatafora; Jason E Stajich,Microorganisms,,,,https://www.ncbi.nlm.nih.gov/pmc/articles/PMC10386755/,PMC10386755
Reviewing the state of biosensors and lab-on-a- chip technologies: opportunities for extreme environments and space exploration,Stefano Cinti; Sima Singh; Giovanni Covone; Luca Tonietti; Annarita Ricciardelli; Angelina Cordone; Roberta Iacono; Arianna Mazzoli; Marco Moracci; Alessandra Rotundi; Donato Giovannelli,Frontiers in Microbiology,,,,https://www.ncbi.nlm.nih.gov/pmc/articles/PMC10470837/,PMC10470837
The interaction of vortical flows with red cells in venous valve mimics,Zyrina Alura C Sanchez; Vignesha Vijayananda; Devin M Virassammy; Liat Rosenfeld; Anand K Ramasubramanian,Biomicrofluidics,,,,https://www.ncbi.nlm.nih.gov/pmc/articles/PMC8896891/,PMC8896891
Mammalian and Invertebrate Models as Complementary Tools for Gaining Mechanistic Insight on Muscle Responses to Spaceflight,Thomas Cahill; Henry Cope; Joseph J Bass; Eliah G Overbey; Rachel Gilbert; Willian Abraham da Silveira; Amber M Paul; Tejaswini Mishra; Raúl Herranz; Sigrid S Reinsch; Sylvain V Costes; Gary Hardiman; Nathaniel J Szewczyk; Candice G T Tahimic,International Journal of Molecular Sciences,,,,https://www.ncbi.nlm.nih.gov/pmc/articles/PMC8430797/,PMC8430797
Investigation of simulated microgravity effects on Streptococcus mutans physiology and global gene expression,Silvia S Orsini; April M Lewis; Kelly C Rice,NPJ Microgravity,,,,https://www.ncbi.nlm.nih.gov/pmc/articles/PMC5460135/,PMC5460135
Altered quorum sensing and physiology of Staphylococcus aureus during spaceflight detected by multi-omics data analysis,Matthew R Hauserman; Mariola J Ferraro; Ronan K Carroll; Kelly C Rice,NPJ Microgravity,,,,https://www.ncbi.nlm.nih.gov/pmc/articles/PMC10774393/,PMC10774393
"Phosphoinositides control the localization of HOPS subunit VPS41, which together with VPS33 mediates vacuole fusion in plants",Carla Brillada; Jiameng Zheng; Falco Krüger; Eliezer Rovira-Diaz; Jana Christin Askani; Karin Schumacher; Marcela Rojas-Pierce,Proceedings of the National Academy of Sciences of the United States of America,,,,https://www.ncbi.nlm.nih.gov/pmc/articles/PMC6126739/,PMC6126739
REGULATOR OF BULB BIOGENESIS1 (RBB1) Is Involved in Vacuole Bulb Formation in Arabidopsis,Sang Won Han; Jose M Alonso; Marcela Rojas-Pierce,PLoS ONE,,,,https://www.ncbi.nlm.nih.gov/pmc/articles/PMC4411111/,PMC4411111
Microgravity enhances the phenotype of Arabidopsis zigzag-1 and reduces the Wortmannin-induced vacuole fusion in root cells,Mengying Wang; Katherine Danz; Vanessa Ly; Marcela Rojas-Pierce,NPJ Microgravity,,,,https://www.ncbi.nlm.nih.gov/pmc/articles/PMC9445043/,PMC9445043
Intrauterine exposure to maternal stress alters Bdnf IV DNA methylation and telomere length in the brain of adult rat offspring,Jennifer Blaze; Arun Asok; Kristyn Borrelli; Christina Tulbert; Justin Bollinger; April E Ronca; Tania L Roth,International journal of developmental neuroscience : the official journal of the International Society for Developmental Neuroscience,,,,https://www.ncbi.nlm.nih.gov/pmc/articles/PMC5600826/,PMC5600826
Sex differences in muscle health in simulated micro- and partial-gravity environments in rats,Megan E Rosa-Caldwell; Marie Mortreux; Anna Wadhwa; Ursula B Kaiser; Dong-Min Sung; Mary L Bouxsein; Seward B Rutkove,Sports Medicine and Health Science,,,,https://www.ncbi.nlm.nih.gov/pmc/articles/PMC10831389/,PMC10831389
Hypergravity disruption of homeorhetic adaptations to lactation in rat dams include changes in circadian clocks,Theresa Casey; Elzbieta I Zakrzewska; Rhonda L Maple; Laura Lintault; Charles E Wade; Lisa A Baer; April E Ronca; Karen Plaut,Biology Open,,,,https://www.ncbi.nlm.nih.gov/pmc/articles/PMC3509447/,PMC3509447
Brassinazole resistant 1 (BZR1)-dependent brassinosteroid signalling pathway leads to ectopic activation of quiescent cell division and suppresses columella stem cell differentiation,Hak-Soo Lee; Yoon Kim; Giang Pham; Ju Won Kim; Ji-Hye Song; Yew Lee; Yong-Sic Hwang; Stanley J Roux; Soo-Hwan Kim,Journal of Experimental Botany,,,,https://www.ncbi.nlm.nih.gov/pmc/articles/PMC4507784/,PMC4507784
Proteomic Study of Microsomal Proteins Reveals a Key Role for Arabidopsis Annexin 1 in Mediating Heat Stress-Induced Increase in Intracellular Calcium Levels,Xu Wang; Xiaolong Ma; Hui Wang; Bingjie Li; Greg Clark; Yi Guo; Stan Roux; Daye Sun; Wenqiang Tang,Molecular & Cellular Proteomics : MCP,,,,https://www.ncbi.nlm.nih.gov/pmc/articles/PMC4349987/,PMC4349987
ANN1 and ANN2 Function in Post-Phloem Sugar Transport in Root Tips to Affect Primary Root Growth,Jing Wang; Jawon Song; Greg Clark; Stanley J Roux,Plant Physiology,,,,https://www.ncbi.nlm.nih.gov/pmc/articles/PMC6130020/,PMC6130020
Mitochondria-Targeted Human Catalase in the Mouse Longevity MCAT Model Mitigates Head-Tilt Bedrest-Induced Neuro-Inflammation in the Hippocampus,Linda Rubinstein; Frederico Kiffer; Stephanie Puukila; Moniece G Lowe; Brie Goo; Amalia Luthens; Ann-Sofie Schreurs; Samantha M Torres; Sonette Steczina; Candice G T Tahimic; Antiño R Allen,Life,,,,https://www.ncbi.nlm.nih.gov/pmc/articles/PMC9695374/,PMC9695374
Apyrase inhibitors enhance the ability of diverse fungicides to inhibit the growth of different plant‐pathogenic fungi,Manas Kumar Tripathy; Gayani Weeraratne; Greg Clark; Stanley J Roux,Molecular Plant Pathology,,,,https://www.ncbi.nlm.nih.gov/pmc/articles/PMC6638264/,PMC6638264
Longitudinal time course of muscle impairments during partial weight-bearing in rats,Marie Mortreux; Frank C Ko; Daniela Riveros; Mary L Bouxsein; Seward B Rutkove,NPJ Microgravity,,,,https://www.ncbi.nlm.nih.gov/pmc/articles/PMC6706399/,PMC6706399
Structural and functional properties of bone are compromised in amyotrophic lateral sclerosis mice,Frank C Ko; Jia Li; Daniel J Brooks; Seward B Rutkove; Mary L Bouxsein,Amyotrophic lateral sclerosis & frontotemporal degeneration,,,,https://www.ncbi.nlm.nih.gov/pmc/articles/PMC6141014/,PMC6141014
Blood Flow Restriction Training: A Tool to Enhance Rehabilitation and Build Athlete Resiliency,Mark Murphy,"Arthroscopy, Sports Medicine, and Rehabilitation",,,,https://www.ncbi.nlm.nih.gov/pmc/articles/PMC12034070/,PMC12034070
Hindlimb suspension in Wistar rats: Sex‐based differences in muscle response,Marie Mortreux; Megan E Rosa‐Caldwell; Ian D Stiehl; Dong‐Min Sung; Nicholas T Thomas; Christopher S Fry; Seward B Rutkove,Physiological Reports,,,,https://www.ncbi.nlm.nih.gov/pmc/articles/PMC8493566/,PMC8493566
Dose-dependent skeletal deficits due to varied reductions in mechanical loading in rats,Frank C Ko; Marie Mortreux; Daniela Riveros; Janice A Nagy; Seward B Rutkove; Mary L Bouxsein,NPJ Microgravity,,,,https://www.ncbi.nlm.nih.gov/pmc/articles/PMC7235020/,PMC7235020
Approaching Gravity as a Continuum Using the Rat Partial Weight-Bearing Model,Marie Mortreux; Megan E Rosa-Caldwell,Life,,,,https://www.ncbi.nlm.nih.gov/pmc/articles/PMC7599661/,PMC7599661
Correction to “Adaptation to full weight‐bearing following disuse in rats: The impact of biological sex on musculoskeletal recovery”,,Physiological Reports,,,,https://www.ncbi.nlm.nih.gov/pmc/articles/PMC10926278/,PMC10926278
Transcriptomic Signature of the Simulated Microgravity Response in Caenorhabditis elegans and Comparison to Spaceflight Experiments,İrem Çelen; Aroshan Jayasinghe; Jung H Doh; Chandran R Sabanayagam,Cells,,,,https://www.ncbi.nlm.nih.gov/pmc/articles/PMC9856674/,PMC9856674
Effects of liquid cultivation on gene expression and phenotype of C. elegans,İrem Çelen; Jung H Doh; Chandran R Sabanayagam,BMC Genomics,,,,https://www.ncbi.nlm.nih.gov/pmc/articles/PMC6069985/,PMC6069985
Enabling Clonal Analyses of Yeast in Outer Space by Encapsulation and Desiccation in Hollow Microparticles,Simon Ng; Cayden Williamson; Mark van Zee; Dino Di Carlo; Sergio R Santa Maria,Life,,,,https://www.ncbi.nlm.nih.gov/pmc/articles/PMC9410522/,PMC9410522
Caenorhabditis elegans in microgravity: An omics perspective,Amanda Scott; Craig RG Willis; Masafumi Muratani; Atsushi Higashitani; Timothy Etheridge; Nathaniel J Szewczyk; Colleen S Deane,iScience,,,,https://www.ncbi.nlm.nih.gov/pmc/articles/PMC10344948/,PMC10344948
Dried plum diet protects from bone loss caused by ionizing radiation,A-S Schreurs; Y Shirazi-Fard; M Shahnazari; J S Alwood; T A Truong; C G T Tahimic; C L Limoli; N D Turner; B Halloran; R K Globus,Scientific Reports,,,,https://www.ncbi.nlm.nih.gov/pmc/articles/PMC4750446/,PMC4750446
Dietary countermeasure mitigates simulated spaceflight-induced osteopenia in mice,Sonette Steczina; Candice G T Tahimic; Megan Pendleton; Ons M’Saad; Moniece Lowe; Joshua S Alwood; Bernard P Halloran; Ruth K Globus; Ann-Sofie Schreurs,Scientific Reports,,,,https://www.ncbi.nlm.nih.gov/pmc/articles/PMC7162976/,PMC7162976
Simulated Microgravity Alters Gene Regulation Linked to Immunity and Cardiovascular Disease,Candice G T Tahimic; Sonette Steczina; Aimy Sebastian; Nicholas R Hum; Metadel Abegaz; Masahiro Terada; Maria Cimini; David A Goukassian; Ann-Sofie Schreurs; Tana M Hoban-Higgins; Charles A Fuller; Gabriela G Loots; Ruth K Globus; Yasaman Shirazi-Fard,Genes,,,,https://www.ncbi.nlm.nih.gov/pmc/articles/PMC11353732/,PMC11353732
Identification of therapeutic targets for chronic kidney disease through Mendelian randomization analysis of druggable genes,Run-Sen Liang; Jin-Qi Su; Xiang-Qi Wu; Qi Wang; Yong-Mei Cai; Hong-Yong Su; Ji-Xin Tang; Cui-Wei Yao,Scientific Reports,,,,https://www.ncbi.nlm.nih.gov/pmc/articles/PMC11953390/,PMC11953390
A New Role of NAP1L1 in Megakaryocytes and Human Platelets,Martin Freitag; Hansjörg Schwertz,International Journal of Molecular Sciences,,,,https://www.ncbi.nlm.nih.gov/pmc/articles/PMC9737020/,PMC9737020
Morphology of Penicillium rubens Biofilms Formed in Space,Megan Hupka; Raj Kedia; Rylee Schauer; Brooke Shepard; María Granados-Presa; Mark Vande Hei; Pamela Flores; Luis Zea,Life,,,,https://www.ncbi.nlm.nih.gov/pmc/articles/PMC10144393/,PMC10144393
Evaluation of rodent spaceflight in the NASA animal enclosure module for an extended operational period (up to 35 days),Eric L Moyer; Paula M Dumars; Gwo-Shing Sun; Kara J Martin; David G Heathcote; Richard D Boyle; Mike G Skidmore,NPJ Microgravity,,,,https://www.ncbi.nlm.nih.gov/pmc/articles/PMC5515519/,PMC5515519
Explainable machine learning identifies multi-omics signatures of muscle response to spaceflight in mice,Kevin Li; Riya Desai; Ryan T Scott; Joel Ricky Steele; Meera Machado; Samuel Demharter; Adrienne Hoarfrost; Jessica L Braun; Val A Fajardo; Lauren M Sanders; Sylvain V Costes,NPJ Microgravity,,,,https://www.ncbi.nlm.nih.gov/pmc/articles/PMC10719374/,PMC10719374
MARSBOx: Fungal and Bacterial Endurance From a Balloon-Flown Analog Mission in the Stratosphere,Marta Cortesão; Katharina Siems; Stella Koch; Kristina Beblo-Vranesevic; Elke Rabbow; Thomas Berger; Michael Lane; Leandro James; Prital Johnson; Samantha M Waters; Sonali D Verma; David J Smith; Ralf Moeller,Frontiers in Microbiology,,,,https://www.ncbi.nlm.nih.gov/pmc/articles/PMC7937622/,PMC7937622
Influence of the spaceflight environment on macrophage lineages,Rocky An; Virginia Katherine Blackwell; Bijan Harandi; Alicia C Gibbons; Olivia Siu; Iris Irby; Amy Rees; Nadjet Cornejal; Kristina M Sattler; Tao Sheng; Nicholas C Syracuse; David Loftus; Sergio R Santa Maria; Egle Cekanaviciute; Sigrid S Reinsch; Hami E Ray; Amber M Paul,NPJ Microgravity,,,,https://www.ncbi.nlm.nih.gov/pmc/articles/PMC11166655/,PMC11166655
Microbial adaptation to spaceflight is correlated with bacteriophage-encoded functions,Iris Irby; Jared T Broddrick,Nature Communications,,,,https://www.ncbi.nlm.nih.gov/pmc/articles/PMC11096397/,PMC11096397
In situ Linkage of Fungal and Bacterial Proliferation to Microbiologically Influenced Corrosion in B20 Biodiesel Storage Tanks,Blake W Stamps; Caitlin L Bojanowski; Carrie A Drake; Heather S Nunn; Pamela F Lloyd; James G Floyd; Katelyn A Emmerich; Abby R Neal; Wendy J Crookes-Goodson; Bradley S Stevenson,Frontiers in Microbiology,,,,https://www.ncbi.nlm.nih.gov/pmc/articles/PMC7055474/,PMC7055474
The rapid diagnosis and effective inhibition of coronavirus using spike antibody attached gold nanoparticles,Avijit Pramanik; Ye Gao; Shamily Patibandla; Dipanwita Mitra; Martin G McCandless; Lauren A Fassero; Kalein Gates; Ritesh Tandon; Paresh Chandra Ray,Nanoscale Advances,,,,https://www.ncbi.nlm.nih.gov/pmc/articles/PMC8323809/,PMC8323809
"Identification of Metagenome-Assembled Genomes Containing Antimicrobial Resistance Genes, Isolated from an Advanced Water Treatment Facility",Blake W Stamps; John R Spear,Microbiology Resource Announcements,,,,https://www.ncbi.nlm.nih.gov/pmc/articles/PMC7118179/,PMC7118179
Nature of Pre-Earthquake Phenomena and their Effects on Living Organisms,Friedemann Freund; Viktor Stolc,Animals : an Open Access Journal from MDPI,,,,https://www.ncbi.nlm.nih.gov/pmc/articles/PMC4494396/,PMC4494396
Safety and Pharmacokinetics of Intranasally Administered Heparin,"Hannah M Harris; Katherine L Boyet; Hao Liu; Rohini Dwivedi; Nicole M Ashpole; Ritesh Tandon; Gene L Bidwell, III; Zhi Cheng; Lauren A Fassero; Christian S Yu; Vitor H Pomin; Dipanwita Mitra; Kerri A Harrison; Eric Dahl; Bill J Gurley; Arun Kumar Kotha; Mahavir Bhupal Chougule; Joshua S Sharp",Pharmaceutical Research,,,,https://www.ncbi.nlm.nih.gov/pmc/articles/PMC8890767/,PMC8890767
Inhibition of SARS-CoV-2 wild-type (Wuhan-Hu-1) and Delta (B.1.617.2) strains by marine sulfated glycans,Rohini Dwivedi; Poonam Sharma; Marwa Farrag; Seon Beom Kim; Lauren A Fassero; Ritesh Tandon; Vitor H Pomin,Glycobiology,,,,https://www.ncbi.nlm.nih.gov/pmc/articles/PMC9487896/,PMC9487896
Blocking SARS-CoV-2 Delta Variant (B.1.617.2) Spike Protein Receptor-Binding Domain Binding with the ACE2 Receptor of the Host Cell and Inhibiting Virus Infections Using Human Host Defense Peptide-Conjugated Graphene Quantum Dots,Avijit Pramanik; Poonam C Sharma; Shamily Patibandla; Ye Gao; Vinod Ruppa-Kasani; Jagruti Goli; Animesh Kumar; Abhirup Chatterjee; Sudarson Sekhar Sinha; John T Bates; Michael A Bierdeman; Ritesh Tandon; Paresh Chandra Ray,ACS Omega,,,,https://www.ncbi.nlm.nih.gov/pmc/articles/PMC8886715/,PMC8886715
Inhibition of Cytomegalovirus by Pentacta pygmaea Fucosylated Chondroitin Sulfate Depends on Its Molecular Weight,Poonam Sharma; Rohini Dwivedi; Priya Ray; Jayanti Shukla; Vitor H Pomin; Ritesh Tandon,Viruses,,,,https://www.ncbi.nlm.nih.gov/pmc/articles/PMC10142442/,PMC10142442
The multiscale structural and mechanical effects of mouse supraspinatus muscle unloading on the mature enthesis,Alix C Deymier; Andrea G Schwartz; Zhounghou Cai; Tyrone L Daulton; Jill D Pasteris; Guy M Genin; Stavros Thomopoulos,Acta biomaterialia,,,,https://www.ncbi.nlm.nih.gov/pmc/articles/PMC6343501/,PMC6343501
A Tissue Retrieval and Postharvest Processing Regimen for Rodent Reproductive Tissues Compatible with Long-Term Storage on the International Space Station and Postflight Biospecimen Sharing Program,Vijayalaxmi Gupta; Lesya Holets-Bondar; Katherine F Roby; George Enders; Joseph S Tash,BioMed Research International,,,,https://www.ncbi.nlm.nih.gov/pmc/articles/PMC4309301/,PMC4309301
Effect of Simulated Cosmic Radiation on Cytomegalovirus Reactivation and Lytic Replication,Satish K Mehta; Douglass M Diak; Sara Bustos-Lopez; Mayra Nelman-Gonzalez; Xi Chen; Ianik Plante; Stephen J Stray; Ritesh Tandon; Brian E Crucian,International Journal of Molecular Sciences,,,,https://www.ncbi.nlm.nih.gov/pmc/articles/PMC11477029/,PMC11477029
Reproducible changes in the gut microbiome suggest a shift in microbial and host metabolism during spaceflight,Peng Jiang; Stefan J Green; George E Chlipala; Fred W Turek; Martha Hotz Vitaterna,Microbiome,,,,https://www.ncbi.nlm.nih.gov/pmc/articles/PMC6689164/,PMC6689164
Failure to Generate Bone Marrow Adipocytes Does Not Protect Mice from Ovariectomy-Induced Osteopenia,Urszula T Iwaniec; Russell T Turner,Bone,,,,https://www.ncbi.nlm.nih.gov/pmc/articles/PMC3564669/,PMC3564669
